<?xml version="1.0" encoding="UTF-8"?>
<stickyPolicy xmlns:xs="http://www.w3.org/2001/XMLSchema-instance" xs:noNamespaceSchemaLocation="PKIstickypolicy.xsd">

    <trustedAuthority>trustedAuthority1</trustedAuthority>
    <trustedAuthority>trustedAuthority2</trustedAuthority>

   <owner>
        <referenceName>referenceName1</referenceName>
        <ownersDetails>ownersDetails1</ownersDetails>
        <ownersDetails>ownersDetails2</ownersDetails>
    </owner>

   <policy>
        <target>target1</target>
        <target>target2</target>
        <dataType>picture</dataType>
        <validity>
            <day>12</day>
            <month>10</month>
            <year>2020</year>
        </validity>
        <constraint>constraint1</constraint>
        <constraint>constraint2</constraint>
        <action>action1</action>
    </policy>

   <policy>
        <target>target3</target>
        <target>target4</target>
        <dataType>audio</dataType>
        <dataType>position</dataType>
        <validity>
            <day>21</day>
            <month>4</month>
            <year>2021</year>
        </validity>
        <constraint>constraint3</constraint>
        <action>action2</action>
        <action>action3</action>
    </policy>
</stickyPolicy>
